{
  "@context": "https://mailschema.org/contexts/map-0.3.jsonld",
  "@type": "MailAction",
  "profile": "https://mailschema.org/profiles/map/0.3",
  "type": {
    "id": "https://mailschema.org/types/publication-approval",
    "version": "0.1",
    "contractDigest": "sha-256:247dc8524076c11b713b83ee4fa0168bae4df0f9456758d48d9483b3ece70c5b"
  },
  "@id": "urn:uuid:0199a6c2-4b1e-7c3a-9d2e-5f8a1b2c3d41",
  "issuedAt": "2026-10-02T08:00:00Z",
  "expiresAt": "2026-10-03T08:00:00Z",
  "inLanguage": "en",
  "service": {
    "id": "https://service.example",
    "tenant": "urn:example:tenant:7"
  },
  "recipient": "owner@example.net",
  "subject": {
    "id": "urn:example:object:42",
    "title": "Publish the documentation revision"
  },
  "terms": {
    "id": "urn:example:proposal:p7",
    "version": "\"p7-r4\""
  },
  "human": {
    "url": "https://service.example/review/p7"
  },
  "details": {
    "summary": "Publish the approved documentation revision.",
    "requester": "Documentation editor",
    "content": {
      "id": "urn:example:content:42",
      "revision": "r4",
      "digest": "sha-256:1111111111111111111111111111111111111111111111111111111111111111",
      "title": "September update"
    },
    "destinations": [
      {
        "id": "https://docs.service.example/guide",
        "account": "urn:example:account:7",
        "visibility": "public"
      }
    ],
    "schedule": {
      "mode": "scheduled",
      "at": "2026-10-02T10:00:00Z"
    }
  },
  "operations": [
    {
      "id": "approve"
    },
    {
      "id": "decline"
    },
    {
      "id": "request-changes"
    }
  ]
}
